{
  "schema_version": "agent-workforce.v1",
  "effective_date": "2026-08-14",
  "authority": {
    "controller": "starlight-queen",
    "control_plane_ref": "configs/starlight-queen-control-plane.example.json",
    "human_owner": "frank",
    "review_mode": "advisory",
    "allowed_automations": [
      "collect_normalized_evidence",
      "run_structural_validation",
      "run_sandbox_evals",
      "render_weekly_review",
      "render_monthly_review",
      "recommend_restriction",
      "quarantine_on_critical_security"
    ],
    "prohibited_automations": [
      "promote",
      "restore_from_quarantine",
      "widen_tools",
      "widen_write_scope",
      "increase_budget",
      "deploy",
      "publish",
      "external_send",
      "retire_or_delete"
    ]
  },
  "review_policy": {
    "timezone": "Europe/Amsterdam",
    "cadence_days": 7,
    "monthly_cadence_days": 30,
    "min_weekly_reviews_per_month": 3,
    "evidence_stale_after_days": 8,
    "probation_min_accepted_runs": 10,
    "promotion_min_accepted_runs": 30,
    "required_eval_mode": "live",
    "required_security_verdict": "PASS"
  },
  "assignments": [
    {
      "assignment_id": "starlight-operator-private",
      "agent_id": "starlight-operator",
      "card_ref": "cards/hosts/starlight-operator.json",
      "access_bundle_ref": "configs/agent-access-bundle.example.json",
      "deployment_ref": "observability/deployments/starlight-operator-hermes.json",
      "eval_suite_ref": "evals/starlight-operator.v1.json",
      "supervisor": "starlight-queen",
      "status": "planned",
      "risk_tier": "high",
      "runtime": {
        "controller": "starlight-queen",
        "executor": "hermes",
        "trigger": "hermes-cron",
        "gateways": ["openclaw"],
        "specialists": ["codex", "claude-code", "openhands"],
        "integrations": ["n8n", "mcp"]
      },
      "review": {
        "cadence_days": 7,
        "last_completed_at": null
      },
      "security": {
        "profile_id": "l4-private-operator",
        "required_before_status": ["probation", "active", "restricted"],
        "latest_assessment_ref": null
      },
      "human_gates": [
        "publish",
        "external_send",
        "spend",
        "dns",
        "credentials",
        "destructive",
        "legal_ip",
        "brand_identity",
        "promotion",
        "restore_from_quarantine",
        "retirement"
      ],
      "evidence": {
        "private_sink": "private:SIS/agent-workforce/starlight-operator-private/",
        "raw_content_policy": "prohibited"
      }
    }
  ]
}
